{
  "schema_version": 1,
  "id": "N5",
  "version": "1.0.0",
  "title": "verify",
  "script": "claude/workflow/tools/ci-select.sh",
  "depends_on": [
    "N4"
  ],
  "input": {
    "path": "records/N5.input.json",
    "schema_version": 1
  },
  "output": {
    "path": "records/N5.output.json",
    "schema_version": 1
  },
  "checklist": [
    {
      "box": "Only the touched suite ran",
      "proof": "verify.json lists the suite and exit 0"
    }
  ],
  "bundle": {
    "checklist_doc": "claude/workflow/dag/nodes/N5.node.json",
    "runbook": "claude/workflow/runbooks/RB-dag-intake.md",
    "playbook": "claude/workflow/dag/playbooks/PB-intake.md",
    "docs": [
      "docs/design/dag-state.md",
      "docs/design/dag-state.spec.xml",
      "docs/design/dag-state-nodes.spec.xml",
      "claude/workflow/dag/schemas/node.schema.json",
      "claude/workflow/dag/schemas/state.schema.json"
    ]
  },
  "retry": {
    "max": 3,
    "waits_seconds": [
      5,
      30,
      120
    ],
    "idempotent": true
  },
  "serial": null,
  "parallel": "none"
}
